Dialogue_ID	Utterance_ID	Utterance	label
17	9	hi!	g
893	6	look, i've been thinking about it.	s
255	14	i'm joan collins.	s
585	9	wait, wait, wait.	c
992	8	we hate that guy.	o
398	13	...like a...	s
443	2	oh rachel, i know the best coffee house and it's sooo close.	s
642	2	yeah!  all right, maybe you don't have to smile. let's try something else. let's try umm, try looking sexy.	ans
522	2	oh.  it's just so unexpected! i…i uh…boy i'll tell you it's just such an honor to be nominated for a	s
441	7	oh umm, i-i don't know if i want to wear a woman's shirt.	o
950	4	no. no, you're not a loser.	o
155	0	ross?	s
559	2	then i look down, and i realize there's a phone... there.	s
643	4	hey! what's she doing back here?	q
40	13	i don't think this number's right!	o
593	5	why does this keep happening to me?	q
305	13	great. i'll ah, see ya then.	s
852	6	if it was, would you stop hanging out with her?	q
657	12	i know! i almost called off my wedding. oh, who's your band?!	s
982	1	okay, here you go.  i have two queens, what do you have?	q
354	14	that's terrible.	o
78	3	why is ross doing that?	q
942	0	last stop, montreal. this stop is montreal.	s
910	0	hi.. how was the game?	q
918	10	chandler is a great name!	o
964	3	well, there's this one thing… okay,  here goes.	s
277	4	but believe me, that's not gonna happen today.	o
766	0	yeah, and i am okay with being a pushover.	o
819	7	no i'm serious, we should tell each other	o
116	5	my dad says if i spend as much time helping him clean apartments, as i do daydreaming about outer space, he'd be able to afford a trip to the taj mahal.	s
274	4	just a sec, give me a minute to wake up for this—ah-ha-ha!!	s
524	15	why, do i have a feeling that's not as happy as it sounds?  no! nooooo!!!	q
649	5	actually, it's just bag.	o
318	3	about a half an hour.	ans
499	10	you do?	q
674	0	so, phoebs owes $7.50, monica, you owe $10, and rachel, you owe fifteen big ones.	s
1024	9	okay! here we go. pillow.	q
596	16	a real man wouldn't just run to the hospital!  no! what would, what would krog do?	q
603	6	the armadillo was actually not so	s
1011	10	all right let me see.  uma thurman, winona ryder, elizabeth hurely, michelle pfieffer, and dorothy hammel?	s
615	21	yeah, 'cause otherwise someone might get what they actually ordered.	ag
244	0	hi everyone.	g
478	6	yeah, we saw this really interesting website about marriage and how totally unnecessary it is and how its just a way for the government to keep tabs on you.	o
222	0	bing! ho! and the bing-ette!	oth
641	1	did she call? you-you told her i was sick right? always tell her i am sick!	ans
720	15	no-no-no-no!	dag
563	8	oh! thank you! thank you! thank you! yes! thank you!	a
1024	12	string?	ans
649	1	no, i'm picking you up for our date. these are for you.	ans
524	6	sure.	ag
99	13	hi! nice to meet you!	g
374	7	you already got the first class tickets.. you got the lounge!	s
337	9	yes! remember? right before we cut the cake, i went up to you and i said	s
478	4	what are you up too?	q
538	1	yeah but	oth
18	10	i know!  don't switch hands, okay?	o
956	10	okay?	ag
146	12	y'know what the saddest part is, when we were playing together, that was like the most fun i've ever had in like all my lives.	o
733	2	oh, yeah, no problems. it's all taken care of.	ans
761	5	ow! ow! ow!	b
777	1	yeah no, i'm telling you rachel has such a great eye for this stuff.	s
361	14	yeah, 'cause that's why you won't get isabella rosselini, geography.	ag
989	9	why?	q
869	12	and you'll be all, 'ohh, man!'	o
2	0	hey, mon.	g
284	2	i don't know.  a cowboy theme?	ans
806	0	i don't know how any of these got opened?!	q
934	1	hi, this is heldi from the morgan chase museum.	s
146	7	that's what i said.	a
112	3	okay, i will find someplace else to do the rest of my appointments. i just don't know what the big deal is!	q
9	2	oh, and in case you were wondering, those are my legs on the new james bond poster.	s
727	7	so what job did you get joe?	q
1024	0	hi!	g
874	3	y'know what? it was a stupid play anyway!	o
583	9	i	oth
15	11	i started to realize that i was having feelings for someone  else.	o
443	0	let's get the show on it!	c
812	13	my boyfriend really does have good taste!	ans
354	0	i could have birds.	s
644	8	oh mon, i laughed so hard	s
281	1	hey!	g
561	10	well, who's to say what's true? i mean...	q
593	1	yeah, we got, um-hmm.	s
597	9	no, i mean, come on, seriously think about it, we get married, we're up at the altar and i'm like this.	o
252	0	where exactly is your zoo?	q
452	1	yeah, i mean i was up sick all night.	s
530	8	now, look i deserve to know where i came from.	s
902	13	come on!	s
553	12	what do you mean?	q
292	3	hey everybody!	g
291	1	oh yeah?	b
412	2	uh-huh, first you tell us where you got the prettiest lace in all the land.	q
578	5	i could be chandler's new roommate.	s
964	15	sorry. sorry.	ap
932	1	stop going through my stuff !	c
474	13	what do you, what do you mean?	q
214	2	david the scientist guy, david that i was in love with, david who went to russia and broke my heart david!	ans
465	5	oh! ...hello, dear.	g
972	9	uh-huh! uh-huh! and-and-and i'll always remember that summer because that's when i realized that we are related.	o
129	7	uh, de-clawing cats.	oth
277	6	well, i said that i	ans
310	3	hey, rach! i made a pile of your stuff over on this side of the room. if you could just……throw your purses at it.	s
183	18	what?	q
940	0	oh, that is so unfortunate.	o
949	9	kate miller it is.	ans
828	1	oh, 'scuse me. i was kinda using that machine.	s
45	2	it's not that bad.	s
358	12	yeah, yeah, first there was my aunt mary, and then there was umm, john, my mailman, and then my, my cowboy friend 'albino bob'.	ans
165	8	you do this, you give me the great advice, and hey listen, i was thinking about what you said yesterday about focusing on one woman, i'm gonna do that.	o
161	2	listen, can you do me a favor?	q
921	3	well i was just so excited to see you.	ans
39	9	yes?	ag
991	8	oh no!	ans
211	11	what?	q
630	6	okay!	ag
542	2	oh my god, they took my idea!	s
479	7	yeah, i've always hated that howie.	o
596	1	that is true.	ag
603	2	that's right, and that's why we celebrate hanukkah today. the end.	ag
597	3	why are you reading this? you hate this kind of stuff.	q
658	6	it's the next day!	s
967	0	oh my, oh my god!	oth
388	10	aw!	a
943	3	let's give it a shot.	s
859	0	ursula!  wait! err-err, it's me! phoebe!	s
404	11	i know!	ag
548	0	oh, ain't this nice? it's so quiet, i could just lie here all day.	q
652	7	she's amazing! she makes the women that i dream about look like short, fat, bald men!	o
640	15	i love working with designers!	s
867	6	oh that.	oth
674	4	oh, i cursed it. so now bad things will happen to he who spends it.	ans
671	15	nah ah! nah ah!  no no no! no ad-libbing    and dude, you can't	dag
629	6	oh, this is so cute.	o
510	0	i'm just sayin' if dogs do experience jet lag, then, because of the whole um, seven dog years to one human year thing, then, when a dog flies from new york to los angeles, he doesn't just lose three hours, he loses like a week and a half.	s
263	3	phoebe, i'm engaged!	dag
129	8	hey, tell ya what.	s
960	0	the waiter carried the breadsticks in his pants!	s
297	4	yeah!	b
0	4	my duties?  all right.	ag
568	4	bye chandler!   i miss you already.	g
908	14	what?! all right—hey! don't look at me! you're the one who wanted to come up and look for some stupid	s
1003	6	oh, you bet i am!	ans
723	1	nice! one and a half carat easy.	a
179	12	i won't speed.	ans
791	13	hey, y'know what?	q
507	5	just a touch.	ans
454	2	fine! then you tell roger because he was really looking forward to this!	c
678	11	i'm gonna get coffee.	s
574	5	oooooooooooooohhhhhhhhhhh	b
902	4	you are	ans
521	5	i'm sorry, i'm sorry, i'm sorry.	ap
827	5	okay, all right don't judge me to much.	s
319	5	yeah?	b
297	9	all right.	s
497	1	yeah, well, you're wrong! okay, you're wrong.	dag
192	5	ewww. yeah. umm. i think i'm gonna stay here.	o
415	0	what's with her?	q
296	7	..dr. oberman. okay. and is he-	q
365	13	: toby... oh, for god's sake, i don't know what she's talking about!	s
720	11	um-hmm! look, i-i-i don't know how much more of this i can take! did you know he taped over my	s
703	6	i suddenly had the feeling that i was falling. but i'm not.	s
9	3	can you hold on a moment? i have another call.  i love her.	s
727	6	no, you messed it up. you're stupid.	o
54	4	but i really think i can do it, i'm just gonna need some help.	o
614	0	so, we're decided, no on plaid, yes on pink?	q
392	7	that just cost me four bucks. but uh listen, i just called to see how the chick and the duck are doing?	q
819	14	oh my god. he threw up?	q
671	12	but the guy i said it to dies in the next scene so i    guess it means  you're gonna get eaten by a bear .	s
809	8	okay, give me a chance to win my money back. okay? sudden death, one goal, $1,000.	s
46	9	but, we pick again! we pick again!	o
805	2	oh right its that girl's phone number.	ans
512	1	hi!	g
680	3	now look, there's only one problem though.	s
74	3	yeah.	ag
228	1	look, pheebs, i just, i wanna apologize for, for saying that your method was stupid and-and maybe ask you to be my teacher again.	ap
557	6	sure!	ag
307	10	ohhh, i	oth
1012	3	uh-huh, me too. ross, maybe i should've specified that i'd be needing a grown up doctor.	o
964	0	hey, so uh, y'know how there's something i wanted to talk to you about?	q
444	2	no, this is a loaner.	ans
431	8	yeah, all of us! all day!	ag
897	1	little girl misses her cat.	s
445	7	really?!	q
629	7	oh, i got that for him.	s
22	1	it's just her water breaking. calm down, will you?	ans
163	10	you got	oth
885	1	so, will you talk to him?	q
54	1	so forcing her to marry bobby is gonna make that happen?	q
501	10	a little.	ans
634	1	fine.	ans
173	1	what?!	q
671	1	now, do you have any idea what you just said?	q
446	11	so ah, we on for tomorrow?	q
796	19	i like a girl with a strong jaw.	o
354	13	he musta been sweeping. they found a broom in his hand.	ans
971	0	y'know, me and him do stuff all the time without you and you don't get all upset.	s
939	12	why?! you two are so meant to be together, everybody thinks  so.	s
534	1	yeah! thank you so much for letting me stay here.	ans
930	10	die hard	s
841	10	it was a mistake. please don't take this to mean anything, because it doesn't.	ap
443	4	oh, hey, look, i found coffee!  okay, let's skedaddle.	c
529	7	uh, that was your sister actually.	s
370	0	really mr. geller, you don't have to do this.	o
170	11	it's okay. i suppose it could happen to anyone, not anyone i know, but... by the way i can still see it.	o
629	3	we laugh, we play.	s
160	7	i can get a quick bite to eat, but then i have to come back up here.	ans
626	0	hi, again.	g
478	3	hey!	g
448	2	i'm monica.	ans
886	5	well, so, why don't you just turn it off?	q
791	0	they made you head of the department!	s
576	2	oh, we're gonna flip for the baby?	q
231	12	yeah, but wait...	oth
736	2	i just, i had to see you one more time before you took-off.	ans
980	2	how?s it going.	q
670	1	oh god, oh.	oth
191	6	hey uh, would you two girls like to go for a drink?	q
661	7	oh, so, forget about the birds, but big red insects suggest fine dining!	s
646	10	still.	oth
638	9	well, i don't know what's in the boxes down here, but i do know there are six or seven	s
820	3	nothing, i'm just practicing blowing you off because i'm gonna be a big movie star!	ans
410	11	no, no, no... why, because it might get weird for everyone else?	q
528	4	well, y'know it's none of my business, but aren't you married?	q
145	16	you cook naked?	q
849	9	joey, you look nothing like ben.	o
504	7	yeah, you want some?	q
934	0	you've reached monica and chandler's, if you're listening to this message, we're probably screening.  yeah we are.	s
964	16	okay, i uh, i can't see you anymore.	s
1028	0	anyway, his name is allan and we've been going out for three years.	s
436	2	get out of the way jackass!	c
853	7	what?!  what the hell?!	dag
774	3	this is a safe street, this is a safe building, there's nothing	o
119	10	and y'know the other one over there, that's the stairway.	s
449	7	yeah, you still have feelings for me.	ans
155	6	i'm good except umm, you still owe me a dance.	ans
407	10	welcome back to our fall telethon. now if you've been enjoying the performance of	g
84	6	oh, wait, joshua! joshua!   yeah, well, that oughta do it.	s
730	9	geez, sounds like you should be going on this date!	o
923	1	okay, we have to talk. i'm just getting out of a very serious relationship	o
6	8	i was surprised to see a kangaroo in a world war i epic.	ans
536	3	you went to one where you were popular, and you got to ride off chip's motorcycle, and wear his letterman jacket.	s
672	12	look, y'know what, either it does or it doesn't, and if you have to even	ans
584	9	just hear me out!	s
590	17	look, i don't think so pheebs.  all right, i'll do it. but just because you're a friend.	o
445	19	is that it?	q
54	3	joey, i am scared to death about this.	s
818	4	as someone who's seen more than her fair share of bad beef, i'll tell you: that is not such a terrible thing.	o
504	8	ah, just cut me a little sliver.	ans
185	0	who's this from?	q
404	8	look, i know things have been a little tight since janine moved out.	s
936	0	do you remember where the duck food is?	q
231	6	come on rach, you don't have what, ten minutes?	q
152	4	my brother's going through that right now, he's such a mess. how did you get through it?	q
541	13	like what?	q
211	6	you don't know how that happened?! your dog thought my diaphragm was a chew toy!	s
890	2	uh no, he's not. can i take a message?	q
757	2	y'know, i don't know if you've ever looked up the term goofing around in the dictionary… well, i have, and the technical definition is, two friends who care a lot about each other and have amazing sex and just wanna spend more time together.	s
984	4	ooh, if you take the northern route there's a man in illinois with a beard of bees.	ans
663	7	i	oth
904	6	i guess joey was right, it does nothing.	o
128	4	stating the obvious, but thank you. and it's not weird is it.	q
358	5	so what's a matter, you need a dentist? i've got a good one.	q
982	5	oh yeah! okay, let's play again.  what do you got?	q
703	0	he is so cute.  so, where did you guys grow up?	q
505	5	umm, do you know each other's hometowns?	q
795	2	we fell asleep! that is all.	s
556	3	no, i don't want to hit you.	dag
441	3	no, it's still wet.	dag
726	4	oh my god! you do a great chandler!	o
207	16	well, i was having a conversation.	ans
996	7	i can't ask people to do that? would you ask people to do that?	q
699	4	is that true miss?	q
199	0	rachel, we're sorry for pushing those guys on you.	ap
941	11	things that move me. the, the shadow of a tree, a child laughing, or this lip.	ans
423	0	now, mom, everything's going fine, really.	s
917	2	i found this place that makes the greatest mozzarella sticks and jalepino poppers .	s
222	9	how about we all go out to dinner tomorrow night?	q
99	17	chandler!	oth
956	14	danny! hurry up! the bath is getting cold!	s
867	2	uh-oh.	oth
673	0	you got married again.	q
572	0	well they have uh, some unusual pet names for each other.	s
841	19	so did heldi show you the place?	q
918	0	drum roll.	oth
766	3	i am not a pushover!	o
306	3	oh god, ross i am so sorry.	ap
17	8	i'll get it! i will get that!	s
195	5	um, coffee to go, please.	s
292	0	i work in a cubicle surrounded by people.	s
817	2	no!	dag
354	3	all right, bye-bye.	g
39	0	happy?! is that what i'm supposed to be vic? happy?	q
659	11	these people'll scooch down.	s
788	3	y'know so umm, he's closed the drapes there so he can have a nice, pleasant conversation with your little sister.	o
123	2	okay?	oth
47	15	oh, yeah. he's got that great baby smell. get a whiff of his head.	o
864	3	well, thanks a lot for hookin' me up rach. i want you to know that i want you to attend our wedding as my guest.	o
542	8	oh my.	oth
1029	0	really? like how?	q
21	8	my grandmother has this new boyfriend, and they're both kind of insecure in bed.	ans
415	10	oh, i'm sorry. i forgot you had that whole rachel thing.	ap
1012	10	go little boy, go!	c
922	0	hey!	g
312	9	noo!	ans
828	12	well, you know, no suds, no save.	o
697	4	good. i'm really looking forward to you and me having sexual intercourse.	s
836	3	also an island.	a
615	15	well, i-i could live without it.	ans
241	13	why would you ruin it, who was that hurtin'?	q
15	7	anyway i just, uh, i think it's for the best.	o
54	18	we're gonna be all right. i mean, even if we're not married this baby is gonna be so loved. not just by us.	o
789	9	aww, like i could hurt you. are you making fun of my size? don't make fun of me because of my size!	dag
612	8	i went to the coffeehouse!	s
606	8	chandler.	g
213	2	you know the song! sing along!	s
464	20	all you had to do was buy the card!	s
525	5	so, whaddya think george is like?	q
794	6	now just tell emily that i love her and that i can't imagine spending my life with anyone else.	o
214	10	yeah.	b
320	8	when you were talking about roger, that was killing me!	ans
737	4	sorry, i just…can't sleep.	ap
26	7	yeah!	b
526	8	yeah, for you. is that the list?	q
712	4	oh really? that'd be great! you guys can be the contestants!	ans
767	1	that does not sound stupid to me.	o
476	4	i tried to reach you at work. there's....been a fire.	s
796	5	but only because i was up all night worried about this  meeting, ain't that funny?	ans
739	1	look, you and i have been given a gift.	s
614	16	we could be like the patch sisters!	o
978	8	my god, what were you thinking about?	q
354	12	how did this happen?	q
431	2	yeah?	b
143	4	when they're hungry enough, they'll come in.	ans
317	0	joseph francis tribbiani are you home yet?!!	q
238	5	all right, here we go.	ag
32	13	guys?	oth
904	3	i've had seven pretty serious shocks.	s
902	6	now all you have to do is just get through a little bit more, okay?	o
866	9	well then we'll get wet.	o
241	12	that's not what we're gonna do!	dag
430	2	okay, stop-stop! phoebe?!	c
234	11	oh, you really want to talk about getting people to like you huh, funny man?	q
41	6	no, it's only been six years.	ans
986	11	no. joey, she	ans
655	6	wow!	oth
256	12	get out!!	c
648	6	maybe on some level.	ans
29	6	chandler, we have talked about this.	s
221	0	your parents'?	q
123	6	i can't believe you put that on my alumni page!	s
913	9	i'm intrigued.	s
138	2	wow, that feels so good to get off my chest!	o
114	1	it says here that there's a place you can go to rent videos of all the museums!	s
844	13	yeah, you hang in there teddy!	s
724	5	waaay too special.	ans
583	3	hey, this is hollow.	ans
584	5	i brought something that i want to give you, assuming of course that you want it.	a
274	12	of course!!	ans
639	7	what do you see?	q
964	8	no!	s
574	17	i know, it's great!	ag
225	1	hi! sorry i'm late. were you sleeping?	q
561	13	oh!	b
523	5	so what's it gonna be?	q
659	0	so, um, what do you do for a living?	q
1009	7	no, no, that's not what we ordered... we ordered a fat-free crust with extra cheese.	s
481	5	ok, off the top of my head... don and janet.	ans
288	16	oh so-so not really never.	s
572	20	don't you talk to my husband like that you stupid bastard!	s
959	9	okay, i'll be up in,  18 pages. front and back. very exciting.	ag
108	3	yeah? the work problem?	b
479	4	yeah, he-he-he calls me up and asks me if he can edit my new movie.	s
418	16	are all the questions this personal?	q
907	3	no but you shouldn't! don't ever do that again.	dag
150	2	you think you can knock up my daughter and then not marry her?! i'm gonna kill you!!	s
977	12	huh.	oth
895	7	if that happens at another building that i manage, people are gonna start asking questions.	s
237	0	so! i'm just an empty vase, huh?	q
43	6	no. nothing.	ans
901	1	i'd really prefer a mountain bike.	s
180	13	what?!	q
509	5	well then we'd be in a lot of trouble, you don't know where any countries are.	ans
18	7	what?	q
806	3	oh hey! you got my parent's gift!	s
654	7	so, are we going in there?	q
1018	16	what happened to you two?	q
871	9	but, all right, i don't—maybe i'll just name him the hulk.	o
977	5	you are totally jealous.	o
230	1	i'm really glad we came.  you're so pretty. i love you.	o
571	11	and yet, we're still poking him.	s
515	0	hey guys.	g
202	2	well, let's just say that krog will be fully equipped to destroy the universe again in twelve to fourteen hours.	ans
972	2	thank god.	oth
99	15	so, are you ready to go?	q
4	3	ah y'know, this building is on my paper route so i...	s
185	1	oh, that's ross's.	ans
113	4	we we had our first fight this morning.	s
317	9	so what?! that doesn't give you the right to ditch me!	o
796	18	that's a picture of your daughter, isn't it,  well she's lovely.	s
51	1	hi. look um, about what happened earlier...	s
199	5	i wanna say a disease.	ans
1012	2	umm, i'm actually a first year resident, but i get that a lot, you see, i-i graduated early	ans
822	2	okay, um, oh, the zoo commercial.	s
819	5	secret? married people aren't supposed to have secrets between one another. we have too much love and respect for one another.	o
58	2	that sounds great!	ag
384	0	oh hello.	g
660	5	it was embarrassing, kids made fun of me.	s
844	3	i will sit with you dr. geller.	s
362	0	oh that's five ross. five women have had five babies! and i have had no babies! why doesn't she want to come out?	q
93	0	all right, there's a nuclear holocaust, i'm the last man on earth. would you go out with me?	q
418	10	can't you figure that out based on my date of birth?	q
375	1	okay, well then how about a handshake?	q
865	3	used to work with her. used to! i'm a relative and i didn't get invited! a	s
910	2	we won!! thank you! yes!	oth
15	17	please!	oth
508	5	uh-oh.	b
572	9	honey i swear! i wasn't looking at her!	dag
749	3	okay, ah umm, ah, a 8. ah, a 6?	ans
349	5	i'd love to!	ag
424	2	you know that girl i told you about who lives up in poughkeepsie?	ans
314	4	no! i'm so happy for them!	s
1016	3	y'know i don't, i don't need them, huh, i've got you guys now as friends, you and susan.	s
473	1	i already fed her.	s
733	8	okay.  you uh, you wanna hear something weird?	q
270	2	oh great! what, you brought joey?	q
558	6	you told this guy that i was looking for a fling?! you don't tell the guy that!	s
843	5	my parents spent the money for our wedding!	s
514	6	you don't seem to understand. see, i was dr. drake remoray.	o
602	5	huh. that's nice.	oth
505	0	phoebe, oh my god! wh-wh-what are you doing here?	q
183	1	phoebe!	g
357	3	what? mine aren't tinted.	q
772	12	hi, joey!	g
258	6	fine! maybe i will too!	o
491	2	you had a rough day, huh.. c'mere.	c
1012	1	hi! and you're going into what grade?	q
898	4	what, are you crazy? when a blind man gets his sight back, does he walk around like this?	q
295	2	a date?!	q
719	4	i bet it's fast.	o
616	0	awww! mel torme died.	oth
405	1	i can't take it anymore.	s
516	3	my boots in tan! hey! can you get a little closer so i can see the price?	q
440	11	eww!	b
322	0	oh my god stu! i-i can't believe you did this! now are you absolutely sure she's a hooker?	q
560	7	here we go! here we go! here we go!  how you doin'?	q
744	8	...oh god.	s
623	16	so you might say, the ring is irreplaceable?	q
666	9	we'll be right there!  can't you just say it starts later?	q
365	7	ok, alright, ok, um... then could you please, uh... just give him a message for me? please? this is	ag
158	2	wanna peek?	q
187	0	well that was depressing, i think i just bought a soft pretzel from one of the kids from	o
892	10	remember that guy that gave me a bad review? well…  i'm getting my revenge!	ans
810	9	oh please!  did you hear that? little drops of heaven.	s
578	7	he told me in person.	s
225	6	you're a genius, ross.	o
312	19	well! good night.  i'm going upstairs.	g
1036	10	a week?	s
441	4	let me get it out before it sets.	s
596	17	that was the only way i could get him to	ans
200	0	hey! so uh, was he excited about the tickets?	q
883	0	i don't think i should say.	ans
925	6	nothing at all.	oth
1000	2	actually, i think this apartment sullies the good name of crap	ans
1014	1	you don't-you don't want to hear about my dream officer…pretty?	q
450	3	gimme this.	c
46	4	all right, cut, let's pick again, pick again.	o
553	4	they've been taping those people up there all day.	s
935	12	comin' out. place your bet.  dice are out.  double or nothin'! pay the front line!	s
871	8	well, i, i like the idea of naming him after someone i love, and joey and chandler are great names.	ans
777	11	oh, she does want to.	ag
876	1	joey. joey. joey. joey! joey!!	oth
840	1	hi pheebs!	g
1026	11	oh, y'know i-i can't hear that enough.	s
41	1	hey ma. listen, i made the appointment with dr. bazida, and... excuse me?  did you know this isn't ma?	q
1038	16	yeah.	ans
78	2	no rachel! they got here first!	s
136	4	let me start by uh, by introducing myself, i am professor geller.	s
830	5	varrrrrrrrroom.	oth
964	13	oh, okay, so i'm sorry, what-what were you-what did you want to tell me?	q
95	12	what?	q
722	0	i know it doesn't make much sense	o
690	3	i'm so glad you liked it.	s
253	1	really helped speed the process along!	o
211	10	anyway, we're really excited about our wedding plans, and well i guess pretty soon we'll be making a big withdrawal from the monica wedding fund.	s
25	4	: yeah.	oth
775	10	no way!	dag
496	13	oh good, oh joey and chandler are back.	s
285	8	okay sweetie, you can do it. just open up and put it in your  mouth.	c
1027	2	umm, well, umm grandma died.	s
1035	0	what about me?! you-you just said i could!	s
740	7	dad, dad i don't want to hear about it.	s
482	16	oh!	b
28	6	you're welcome.  i'm sorry. did i hurt you?	q
278	0	ha!	s
211	9	what?! they wanted a scary story!	s
674	6	bad things happen to me anyway.	s
818	7	well, you do realise the odds of that happening are a little slimmer if they never get to meet the guy..	o
887	12	maybe we could attack them together?	q
68	2	lose the robe.	oth
976	1	ok.	ag
123	1	that only is not funny, it's physically impossible!	o
19	1	hey!	g
51	3	i was gonna give you a chance to apologise to me.	s
370	3	oh no! an asteroid!	s
557	0	well, the delivery went out to you and i realized they forgot this.	s
482	5	how do you know?	q
273	13	hey! so chandler, wanna go to the coffeehouse?	q
1023	1	do you want some shortbread? eh that's scottish like you are.	q
